{
  "schema": "control_canter.p0_closure_receipt.v1",
  "p0_id": "P0-1",
  "status": "PARTIAL",
  "action_class": "COMPENSATABLE",
  "started_at": "REPLACE_RFC3339",
  "completed_at": "REPLACE_RFC3339",
  "scope": "Arena PostgreSQL exposure closure",
  "negative_tests": [
    {
      "test_id": "external_connect",
      "expected": "REFUSED_OR_TIMEOUT",
      "observed": "NOT_RUN",
      "status": "NOT_RUN",
      "timestamp": "REPLACE_RFC3339",
      "command_redacted": "REPLACE",
      "exit_code": null
    },
    {
      "test_id": "listener_binding",
      "expected": "LOOPBACK_ONLY",
      "observed": "NOT_RUN",
      "status": "NOT_RUN",
      "timestamp": "REPLACE_RFC3339",
      "command_redacted": "REPLACE",
      "exit_code": null
    },
    {
      "test_id": "old_credential_login",
      "expected": "DENIED",
      "observed": "NOT_RUN",
      "status": "NOT_RUN",
      "timestamp": "REPLACE_RFC3339",
      "command_redacted": "REPLACE",
      "exit_code": null
    }
  ],
  "continuity_test": {
    "expected": "APPLICATION_CONTINUES_WITH_NEW_ACCESS",
    "observed": "NOT_RUN",
    "status": "NOT_RUN",
    "timestamp": "REPLACE_RFC3339"
  },
  "rotation": {
    "new_access_activated_at": null,
    "old_access_revoked_at": null,
    "break_glass_status": "NOT_APPLICABLE"
  },
  "evidence": [
    {
      "locator": "REPLACE",
      "sha256": "0000000000000000000000000000000000000000000000000000000000000000"
    }
  ],
  "secrets_exposed": false,
  "operator_presence_required": false,
  "notes": "Never include secret values."
}
